{
  "schema_version": "1.0",
  "cohort_status": "COHORT_SUPERSEDED",
  "superseded_at": "2026-10-07T07:37:40.658392+00:00",
  "superseded_by": "integrated-shadow-2acacfbba4400474",
  "reason": "SESSION_AWARE_KIWOOM_PROVIDER_AUTHORITY_CHANGE",
  "prior_progress": {
    "schema_version": "2.6",
    "cohort_id": "integrated-shadow-a0d3e69e9bc23a1b",
    "semantic_fingerprint": "a0d3e69e9bc23a1b3205171a32f2a82880ee6ae728f39c0f7bdbf16dd6652c32",
    "started_at": "2026-10-06T14:26:56.819038+00:00",
    "observed_attempts": 0,
    "valid_shadow_sessions": 0,
    "valid_finalized_sessions": 0,
    "valid_paired_operational_days": 0,
    "preopen_success_count": 0,
    "postclose_success_count": 0,
    "paired_operational_days": [],
    "pending_preopen_sessions": [],
    "excluded_attempts": 0,
    "critical_violations": [],
    "counted_sessions": [],
    "baseline_overlay_sessions": {
      "NBIS": 0,
      "MVLL": 0,
      "SOXL": 0
    },
    "independent_price_covered_sessions": 0,
    "missing_expected_sessions": [],
    "last_attempt_hash": null,
    "checkpoint_status": "FIRST_VALID_SESSION_PENDING",
    "promotion_status": "EXPLICIT_USER_APPROVAL_REQUIRED",
    "order_authority": false
  },
  "order_authority": false
}
