{
  "schema_version": "1.0",
  "cohort_status": "COHORT_SUPERSEDED",
  "superseded_at": "2026-08-14T08:22:07+09:00",
  "superseded_by": "integrated-shadow-a5089a59ee826f79",
  "reason": "SESSION_AWARE_KIWOOM_PROVIDER_AUTHORITY_CHANGE",
  "prior_progress": {
    "schema_version": "2.6",
    "cohort_id": "integrated-shadow-8633bb549d3c7d87",
    "semantic_fingerprint": "8633bb549d3c7d8740c155c4a189a740afcd0ad152d8b64bf2f54c5ad073e213",
    "started_at": "2026-08-13T06:50:00Z",
    "observed_attempts": 1,
    "valid_shadow_sessions": 0,
    "excluded_attempts": 1,
    "critical_violations": [],
    "counted_sessions": [],
    "baseline_overlay_sessions": {"NBIS": 0, "MVLL": 0, "SOXL": 0},
    "independent_price_covered_sessions": 0,
    "missing_expected_sessions": [],
    "last_attempt_hash": "f173fe59b43fb3ea1a1674d4580e08aac1e12c47d09a48c647942869f27c03ca",
    "checkpoint_status": "FIRST_VALID_SESSION_PENDING",
    "promotion_status": "EXPLICIT_USER_APPROVAL_REQUIRED",
    "order_authority": false
  },
  "order_authority": false
}
